,link,text,date,No_of_Likes,No_of_tweets
82,https://twitter.com/AnshPan92563403/status/1711667081626689605#m,"#banknifty, yesterday we had covered 43400 to 43600 are acting as good support  streetwhacks.com #Streetwhacks #stocks #markets #investing #trading #Nifty #banknifty #GIFTNIFTY #OptionsTrading #stockmarkets #StocksToBuy #HDFCBank #Optionselling #Sensex #Reliance","Oct 10, 2023 · 8:56 AM UTC",1,0
83,https://twitter.com/ETNOWlive/status/1711666215956222129#m,Mukesh Ambani’s Salary: Billionaire! Check Reliance Industries Chairman’s annual package  #MukeshAmbani #Reliance https://www.etnownews.com/web-stories/mukesh-ambanis-salary-billionaire-check-reliance-industries-chairmans-annual-package/photostory/104309627.cms,"Oct 10, 2023 · 8:53 AM UTC",2,0
84,https://twitter.com/BizTakOfficial/status/1711657191860502919#m,"बनना चाहते हैं Reliance Industries के पार्टनर?   आपके पास एक खास मौका है जो कि आपको Jio BP दे रहा है। पेट्रोल पंप का डीलर बन आप कमा पाएंगे बंपर मुनाफा, देखिए रिपोर्ट। #RelianceIndustries #JioBP #Reliance","Oct 10, 2023 · 8:17 AM UTC",14,1
85,https://twitter.com/DrishtiKaila/status/1711656774804394100#m,"1 day late but here we are 19700, Waiting for closing, will look for long trade from tomorrow if close above 19720 today #nifty #reliance #tcs #niftybank #banknifty","Oct 10, 2023 · 8:15 AM UTC",2,0
86,https://twitter.com/sure_pure_cure/status/1711651774161948984#m,#BAAP investors like @MarcellusInvest #saurabh mukherjea will not know what hit them when #Reliance #jewels starts making bigger noise. #Titan May grow for now but market will start derating on potential competition. Thoughts @sandipsabharwal @Iamsamirarora @_anujsinghal,"Oct 10, 2023 · 7:55 AM UTC",0,0
87,https://twitter.com/APMEN_Asia/status/1711651461279682828#m,Indian oil refining giant #Reliance Industries showcased its #swappable and #multipurpose #batterystoragetechnology for #electricvehicles (EVs). Get your scoop👉https://shorturl.at/vyHJZ #Reliance #Sustainability #GreenEnergy #ElectricVehicles #BatteryInnovation,"Oct 10, 2023 · 7:54 AM UTC",1,0
88,https://twitter.com/TarunRana009/status/1711648207883952443#m,"Check the charts of below, they are indicating good move from current level. #AsianPaints #Reliance #ATGL #SBICards Lot of opportunities currently to get >20% return in next 10-12 months.  If we do 2 swing trade of 20% in a year, then it is more than enough. #investing #trading","Oct 10, 2023 · 7:41 AM UTC",4,0
89,https://twitter.com/sachinology/status/1711639341876072563#m,"""PRECOGNITION"", The ability to see the future. I should be able to predict danger and even prevent disasters after wearing the Suit. Only Gentleman things.😉  @_duh_factor @pinkaryan @jonty_ahmed @JumaleRamdas @GeorgiaGullini #GeorgiaGulliniGiveaway #Reliance","Oct 10, 2023 · 7:06 AM UTC",1,0
90,https://twitter.com/Goldkk4/status/1711636865391157465#m,BUY FINNIFTY 19700 CE 27---22  Low 18 High 151  Full profit book  G pay 9722265854  जो मुझे पेमेंट करेगा मैं उसे और प्रॉफिट दूंगा। यह  उसूल है।  #bank #HDFCBank #ICICIBank #axisbank #Reliance #RelianceJio #TataMotors #infy #TCS #wipro #vedanta #itc #Adani,"Oct 10, 2023 · 6:56 AM UTC",0,0
