,link,text,date,No_of_Likes,No_of_tweets
76,https://twitter.com/timesofindia/status/1688094829249724416#m,"#Reliance #JioBook launched, laptop and tablets import ban, Data Protection Bill and other top tech news of the week   https://www.gadgetsnow.com/slideshows/reliance-jiobook-launched-laptop-and-tablets-import-ban-data-protection-bill-and-other-top-tech-news-of-the-week/photolist/102459277.cms via @gadgetsnow","Aug 6, 2023 · 7:49 AM UTC",18,2
77,https://twitter.com/newsforyou_01/status/1688091604622704640#m,"Reliance Retail का रिकॉर्ड तोड़, कंपनी का मार्केट कैप पहुंचा 112 बिलियन डॉलर. #Reliance","Aug 6, 2023 · 7:36 AM UTC",0,0
78,https://twitter.com/ADeepPandit/status/1688077695350185984#m,सावन में अपने किसी ऐसे करीब को गिफ्ट करें जियो का 4G फोन वो भी मात्र 999रू में.. #reliance #jiobharat,"Aug 6, 2023 · 6:41 AM UTC",164,0
79,https://twitter.com/ganntradeing/status/1688074656191053824#m,#Reliance Power 2022 VS 2023,"Aug 6, 2023 · 6:28 AM UTC",0,0
80,https://twitter.com/ADILBUKHARI15/status/1688068222103478272#m,Don't ever stop trusting .And don't ever stop hoping .Allah is so ready to give you everything you have dreamed of - but you have to understand it's on HIS TiMING  NOT YOURS. #patience #reliance #faith #gratitude,"Aug 6, 2023 · 6:03 AM UTC",7,0
81,https://twitter.com/TnInvestment/status/1688061273228136448#m,#Reliance Retail in talks with local players to make its new laptop in #India  - Reliance likely to partner with #Dixon Technologies and JV with #Sanmina  - Sanmina has manufacturing facility near #Chennai in which Reliance hold 50% stake  https://www.thehindubusinessline.com/companies/reliance-retail-in-talks-with-local-players-to-make-its-new-laptop-in-india/article67161901.ece,"Aug 6, 2023 · 5:35 AM UTC",81,0
82,https://twitter.com/LoksattaLive/status/1688053097166442497#m,"मोबाइलपेक्षा स्वस्त असणाऱ्या JioBook वर ‘या’ ठिकाणी मिळतोय मोठा डिस्काउंट, एकदा ऑफर्स पहाच  #tech #Reliance #JioBook #laptop https://www.loksatta.com/tech/reliance-jiobook-laptop-massive-discount-amazon-sbi-check-price-and-features-tmb-01-3837008/","Aug 6, 2023 · 5:03 AM UTC",1,0
83,https://twitter.com/A8_krunal/status/1688051161084153858#m,#FriendshipDay #nifty50 #banknifty #finnifty #Reliance #tatamotars #maruti #AdaniGroup #itc #hdfcbank #ICICIBank #SBIN,"Aug 6, 2023 · 4:55 AM UTC",4,1
84,https://twitter.com/GeorgiaGullini/status/1688044729295110144#m,#HappyFriendshipDay to our trendsetting tribe. Let's continue to inspire each other and create fashion moments that last a lifetime! #Reliance #RelianceIndustries #GeorgiaGullini #FriendshipDay2023,"Aug 6, 2023 · 4:30 AM UTC",2,0
85,https://twitter.com/OnlyVimal_India/status/1688044728523145216#m,"Friends are the threads that hold the fabric of our lives together, so let's celebrate Friendship Day, creating a beautiful tapestry of memories & moments. Tag your closest pals & tell them how much they mean to you!  #Reliance #RelianceIndustries #OnlyVimal #HappyFriendshipDay","Aug 6, 2023 · 4:30 AM UTC",8,2
86,https://twitter.com/BT_Bazaar/status/1688044728489848832#m,वैल्यूएशन के हिसाब से मुकेश अंबानी की कौन सी कंपनी निकली आगे  देखिए- https://youtu.be/mqKZbZPyhCY #BTBazaar #ril #reliance #relianceretail #relianceindustrieslimited #mukeshambani #ambani #jio,"Aug 6, 2023 · 4:30 AM UTC",2,0
87,https://twitter.com/itradebrains/status/1688038174818234368#m,FII Cash & Derivative Statistics Dated 04/08/2023 #nifty #nifty50 #niftyoptions #Niftyfutures #niftyfinance #NIFTYIT #banknifty #NiftyBank #nifty500 #OptionsTrading #optiontrading #optionkipathshala #OptionChain #optionbuying #zerodha #hdfcbank #Reliance #ICICIBank #ICICI #sbin,"Aug 6, 2023 · 4:03 AM UTC",0,0
88,https://twitter.com/Dksingh211190/status/1688027486914056192#m,"I want to port back into Airtel from @JioCare @reliancejio, recently I have ported our from Airtel to #JIO #Reliance.  But real data speed is very pathetic post portout . I am very frustrated now. @TRAI what are these operators doing, taking high charges but not providing speed.","Aug 6, 2023 · 3:21 AM UTC",0,2
89,https://twitter.com/keshu_o/status/1688019814491799552#m,There is serious network coverage issue in my area for past 1 month and I am continuously complaining. We are having so much issues because of poor coverage.  @JioCare @reliancejio #jio #Reliance,"Aug 6, 2023 · 2:51 AM UTC",0,1
90,https://twitter.com/STOCKMARKETSPIN/status/1687995493798789121#m,Weekly Detail Analysis for #Nifty50 #BankNifty #CNXFINANCE #SBIN #kotakbank #AxisBank #ICICIBank #hdfcbank #Infy #tcs #Reliance #HUL #HINDUNILVR This video i created for education purpose only. No recommendation. Learn and become independent. https://youtu.be/9w1io5TRxGs,"Aug 6, 2023 · 1:14 AM UTC",1,1
